{
  "$schema": "http://json-schema.org/draft-04/schema#",
  "type": "object",
  "properties": {
    "_id": { "type": "string" },
    "owner": {
      "type": "object",
      "properties": {
        "type": { "enum": ["user", "session"] },
        "id": { "type": "string" }
      },
      "required": ["type", "id"],
      "additionalProperties": false
    },
    "items": {
      "type": "array",
      "items": {
        "type": "object",
        "properties": {
          "id": { "type": "string" },
          "sku": { "type": "string", "pattern": "^[A-Z0-9_-]+$" },
          "name": { "type": "string" },
          "quantity": { "type": "integer", "minimum": 1 },
          "price": { "type": "number", "minimum": 0 },
          "inStock": { "type": "boolean" }
        },
        "required": ["id", "sku", "name", "quantity", "price", "inStock"],
        "additionalProperties": false
      }
    },
    "status": { "enum": ["active", "locked"] },
    "createdAt": { "type": "string", "format": "date-time" },
    "updatedAt": { "type": "string", "format": "date-time" }
  },
  "required": ["_id", "owner", "items", "status", "createdAt", "updatedAt"],
  "additionalProperties": false
}