{
  "_id": "cart_abc123",
  "owner": {
    "type": "user",
    "id": "user_456"
  },
  "items": [
    {
      "id": "item_1",
      "sku": "SKFOR020994",
      "name": "Фильтр масляный",
      "quantity": 2,
      "price": 500.0,
      "inStock": true
    }
  ],
  "status": "active",
  "createdAt": "2025-12-16T10:00:00Z",
  "updatedAt": "2025-12-16T10:05:00Z"
}